{
  "schema_version": "asyncodebench-official-task-images-v1",
  "release": "v0.4",
  "platform": "linux/amd64",
  "policy": {
    "default_runtime_backend": "container",
    "immutable_official_references": true,
    "local_reconstruction_fallback": true
  },
  "records": [
    {"task_id": "asyncodebench:cachetools", "source_task_id": "commit0:cachetools", "image": "docker.io/wentingzhao/cachetools:v0", "digest": "sha256:704f2e901689cc0693b02046a0577eb6c7e824edeb0ef032a0894bcecd9f3e8d", "status": "published"},
    {"task_id": "asyncodebench:deprecated", "source_task_id": "commit0:deprecated", "image": "docker.io/wentingzhao/deprecated:v0", "digest": "sha256:4f2b7547c59edcdf44573560951dad4c5901f82f890f903805af4d4fe1ef9e9d", "status": "published"},
    {"task_id": "asyncodebench:portalocker", "source_task_id": "commit0:portalocker", "image": "docker.io/wentingzhao/portalocker:v0", "digest": "sha256:e6a2994b22c775657424d1d4133dcae6c8da73a056c742ce53fd0f2711d44637", "status": "published"},
    {"task_id": "asyncodebench:tinydb", "source_task_id": "commit0:tinydb", "image": "docker.io/wentingzhao/tinydb:v0", "digest": "sha256:cbb19c9f19165a47490b99d3042a1e596db60bde6197e09b4cd3f75af43369b6", "status": "published"},
    {"task_id": "asyncodebench:wcwidth", "source_task_id": "commit0:wcwidth", "image": "docker.io/wentingzhao/wcwidth:v0", "digest": "sha256:b2540793fd3142e38e248119b02782084d05ff543407c651eaf1a1b94901c0e5", "status": "published"},
    {"task_id": "asyncodebench:requests", "source_task_id": "commit0:requests", "image": "docker.io/wentingzhao/requests:v0", "digest": "sha256:7371e709935ba741ff2caee75bf1de5f6184df024c19f269abc3962db767f69e", "status": "published"},
    {"task_id": "asyncodebench:simpy", "source_task_id": "commit0:simpy", "image": "docker.io/wentingzhao/simpy:v0", "digest": "sha256:2b999edfc1ed3e6035edbd2b1363fcdda68997ebfab644e3e0be17dddc08e4ca", "status": "published"},
    {"task_id": "asyncodebench:parsel", "source_task_id": "commit0:parsel", "image": "docker.io/wentingzhao/parsel:v0", "digest": "sha256:2e5aa89792f288923713e39775441c06d324440fea4eab10b9883bd9b80d2f82", "status": "published"},
    {"task_id": "asyncodebench:filesystem_spec", "source_task_id": "commit0:filesystem_spec", "image": "docker.io/wentingzhao/filesystem_spec:v0", "digest": "sha256:c4ca908992bb2eb5be4d7d0848e7a335e7b1f8c620f5170db0903f665ef4de9a", "status": "published"},
    {"task_id": "asyncodebench:marshmallow", "source_task_id": "commit0:marshmallow", "image": "docker.io/wentingzhao/marshmallow:v0", "digest": "sha256:86a0c2908f5312eb63294baef8fbe7aab44d1afb834f05708fbced12ba29adbc", "status": "published"},
    {"task_id": "asyncodebench:graphene", "source_task_id": "commit0:graphene", "image": "docker.io/wentingzhao/graphene:v0", "digest": "sha256:65d5d5c0def0714330c430140024a13f068bf0513695defb55bc9d6794359cba", "status": "published"},
    {"task_id": "asyncodebench:imapclient", "source_task_id": "commit0:imapclient", "image": "docker.io/wentingzhao/imapclient:v0", "digest": "sha256:66e3aab74a4e4fc99978aa9a8adf95cb14ad79f3fc79f0f0009e0eebb62e9409", "status": "published"},
    {"task_id": "asyncodebench:pexpect", "source_task_id": "commit0:pexpect", "image": "docker.io/wentingzhao/pexpect:v0", "digest": "sha256:90b52fb13dd568c38c8f17be6822dab9aa2117cfbe9fb3a2c08563670e28a093", "status": "published"},
    {"task_id": "asyncodebench:flask", "source_task_id": "commit0:flask", "image": "docker.io/wentingzhao/flask:v0", "digest": "sha256:a5840d3aad786d7de45203ef6319c19d776ec3fa1a4fd6715fd609db67001df9", "status": "published"},
    {"task_id": "asyncodebench:python-rsa", "source_task_id": "commit0:python-rsa", "image": "docker.io/wentingzhao/python-rsa:v0", "digest": "sha256:849c8e7aea78d86a018564377ff9f3f9bf2cd09679a1d87bb4cde6a43ac28643", "status": "published"},
    {"task_id": "asyncodebench:cookiecutter", "source_task_id": "commit0:cookiecutter", "image": "docker.io/wentingzhao/cookiecutter:v0", "digest": "sha256:37c3a7747280ab411147499101997541af0936a3280afdcd6b7f000eafcc8c16", "status": "published"},
    {"task_id": "asyncodebench:apache-tvm-20018", "source_task_id": "pr-hard:apache-tvm-20018", "image": "ghcr.io/kaituozhang/asyncodebench-tvm-20018:v0.4.0", "digest": "sha256:118c1874b8d432571c7bfcd429156350b1bc903f384f161a0a0025a9e5f875bd", "status": "published", "runtime_root": "/opt/asyncodebench/runtime"},
    {"task_id": "asyncodebench:apache-tvm-20073", "source_task_id": "pr-hard:apache-tvm-20073", "image": "ghcr.io/kaituozhang/asyncodebench-tvm-20073:v0.4.0", "digest": "sha256:0baaad54986e5314e0e8d7aa6beb6230ef517a1b52d1221fa93b4f317e549004", "status": "published", "runtime_root": "/opt/asyncodebench/runtime"},
    {"task_id": "asyncodebench:apache-tvm-20107", "source_task_id": "pr-hard:apache-tvm-20107", "image": "ghcr.io/kaituozhang/asyncodebench-tvm-20107:v0.4.0", "digest": "sha256:7e5228f7c3cf7c49552ca192954dd01ed96b98dacf0b97d6182f938efd90a897", "status": "published", "runtime_root": "/opt/asyncodebench/runtime"},
    {"task_id": "asyncodebench:apache-tvm-20153", "source_task_id": "pr-hard:apache-tvm-20153", "image": "ghcr.io/kaituozhang/asyncodebench-tvm-20153:v0.4.0", "digest": "sha256:f0d1ffe7b67941e9b3855f9302b89ed8f8ba6502b9989f0125aef3d620ff2c51", "status": "published", "runtime_root": "/opt/asyncodebench/runtime"}
  ]
}
